A1: 股票简称 | B1: 净利润现金含量占比(%)2019.12.31 | C1: 净利润现金含量占比(%)2018.12.31 | D1: 净利润现金含量占比(%)2017.12.31 | E1: 净利润现金含量占比(%)2016.12.31 | F1: 净利润现金含量占比(%)2015.12.31
A2: 安图生物 | B2: 108.88 | C2: 116.2 | D2: 107.88 | E2: 118.89 | F2: 111.01 | G2: =AVERAGE(B2:F2) -> 112.572
A3: 海天味业 | B3: 122.69 | C3: 137.38 | D3: 133.68 | E3: 143.29 | F3: 87.46 | G3: =AVERAGE(B3:F3) -> 124.9
A4: 贵州茅台 | B4: 109.72 | C4: 117.56 | D4: 81.81 | E4: 224.01 | F4: 112.47 | G4: =AVERAGE(B4:F4) -> 129.114
A5: 浙江美大 | B5: 118.12 | C5: 117.05 | D5: 147.01 | E5: 131.51 | F5: 99.89 | G5: =AVERAGE(B5:F5) -> 122.716
A6: 三七互娱 | B6: 154.04 | C6: 193.80000000000001 | D6: 113.04 | E6: 98.299999999999997 | F6: 213.68 | G6: =AVERAGE(B6:F6) -> 154.572
A7: 亿联网络 | B7: 88.44 | C7: 80.28 | D7: 87.27 | E7: 81.01 | F7: 92.94 | G7: =AVERAGE(B7:F7) -> 85.988
A8: 健帆生物 | B8: 102.22 | C8: 95.55 | D8: 106.92 | E8: 88.38 | F8: 102.36 | G8: =AVERAGE(B8:F8) -> 99.086
A9: 通策医疗 | B9: 139.90000000000001 | C9: 141.35 | D9: 160.02 | E9: 118.23 | F9: 153.15 | G9: =AVERAGE(B9:F9) -> 142.53
A10: 济川药业 | B10: 132.33 | C10: 101.26 | D10: 97.16 | E10: 97.74 | F10: 94.01 | G10: =AVERAGE(B10:F10) -> 104.5
A11: 吉比特 | B11: 160.29 | C11: 125.12 | D11: 132.68 | E11: 135.34 | F11: 106.66 | G11: =AVERAGE(B11:F11) -> 132.018
A12: 伟星新材 | B12: 90.99 | C12: 97.799999999999997 | D12: 115.17 | E12: 144.51 | F12: 102.7 | G12: =AVERAGE(B12:F12) -> 110.234
A13: 伟明环保 | B13: 89.06 | C13: 100.52 | D13: 131.09999999999999 | E13: 130.26 | F13: 157.02 | G13: =AVERAGE(B13:F13) -> 121.592
A14: 伊利股份 | B14: 121.95 | C14: 133.93 | D14: 116.75 | E14: 226.38 | F14: 205.89 | G14: =AVERAGE(B14:F14) -> 160.98
A15: 老板电器 | B15: 97.82 | C15: 102.40000000000001 | D15: 87.08 | E15: 128.06 | F15: 135.30000000000001 | G15: =AVERAGE(B15:F15) -> 110.132
A16: 浙江鼎力 | B16: 100.3 | C16: 86.52 | D16: 123.15 | E16: 81.44 | F16: 89.36 | G16: =AVERAGE(B16:F16) -> 96.154
A17: 弘亚数控 | B17: 115.7 | C17: 110.97 | D17: 96.35 | E17: 102.69 | F17: 126.33 | G17: =AVERAGE(B17:F17) -> 110.408
A18: 联美控股 | B18: 90.38 | C18: 86.03 | D18: 121.91 | E18: 146.77 | F18: 227.87 | G18: =AVERAGE(B18:F18) -> 134.592
A19: 集友股份 | B19: 107.76 | C19: 100.11 | D19: 100.38 | E19: 138.34 | F19: 106.75 | G19: =AVERAGE(B19:F19) -> 110.668
A20: 金牌厨柜 | B20: 165.83 | C20: 154.80000000000001 | D20: 214.33 | E20: 258.86 | F20: 399.37 | G20: =AVERAGE(B20:F20) -> 238.638
A21: 爱尔眼科 | B21: 150.73 | C21: 138.75 | D21: 179.18 | E21: 139.13 | F21: 121.99 | G21: =AVERAGE(B21:F21) -> 145.956
A22: 顾家家居 | B22: 182.93 | C22: 102.04 | D22: 139.28 | E22: 169.48 | F22: 152.94 | G22: =AVERAGE(B22:F22) -> 149.334
A23: 今世缘 | B23: 89.66 | C23: 97.42 | D23: 111.77 | E23: 125.26 | F23: 102.48 | G23: =AVERAGE(B23:F23) -> 105.318
A24: 欧派家居 | B24: 117.23 | C24: 128.40000000000001 | D24: 144.44 | E24: 157.63 | F24: 127.93 | G24: =AVERAGE(B24:F24) -> 135.126
A25: 索菲亚 | B25: 120.77 | C25: 114.67 | D25: 137.04 | E25: 179.59999999999999 | F25: 180.76 | G25: =AVERAGE(B25:F25) -> 146.568
A26: 洋河股份 | B26: 92.08 | C26: 111.59999999999999 | D26: 103.86 | E26: 127.08 | F26: 108.78 | G26: =AVERAGE(B26:F26) -> 108.68
A27: 桃李面包 | B27: 129.92 | C27: 125.08 | D27: 127.25 | E27: 119.27 | F27: 123.2 | G27: =AVERAGE(B27:F27) -> 124.944
A28: 正海生物 | B28: 96.36 | C28: 90.27 | D28: 106.17 | E28: 108.31 | F28: 107.64 | G28: =AVERAGE(B28:F28) -> 101.75
A29: 快克股份 | B29: 100.56 | C29: 87.29 | D29: 94.15 | E29: 109.99 | F29: 113.49 | G29: =AVERAGE(B29:F29) -> 101.096
A30: 荣泰健康 | B30: 151.04 | C30: 104.87 | D30: 130.13 | E30: 85.01 | F30: 150.38 | G30: =AVERAGE(B30:F30) -> 124.286
A31: 法拉电子 | B31: 133.94 | C31: 128.18 | D31: 97.79 | E31: 119.14 | F31: 99.200000000000003 | G31: =AVERAGE(B31:F31) -> 115.65
A32: 新坐标 | B32: 89.59 | C32: 102.44 | D32: 98.84 | E32: 95.86 | F32: 95.47 | G32: =AVERAGE(B32:F32) -> 96.44
A33: 泛微网络 | B33: 170.37 | C33: 174.47 | D33: 180.02 | E33: 188.32 | F33: 201.75 | G33: =AVERAGE(B33:F33) -> 182.986
A34: 元祖股份 | B34: 137.71 | C34: 143.92 | D34: 159.57 | E34: 228.52 | F34: 253.74 | G34: =AVERAGE(B34:F34) -> 184.692
A35: 富森美 | B35: 101.56 | C35: 122.64 | D35: 150.47 | E35: 150.84 | F35: 157.83 | G35: =AVERAGE(B35:F35) -> 136.668
A36: 乐凯新材 | B36: 81.73 | C36: 106.26 | D36: 112.57 | E36: 110.73 | F36: 109.74 | G36: =AVERAGE(B36:F36) -> 104.206
A37: 东港股份 | B37: 158.65 | C37: 122.95 | D37: 140.27 | E37: 87.81 | F37: 137.30000000000001 | G37: =AVERAGE(B37:F37) -> 129.396
A38: 崇达技术 | B38: 149.69 | C38: 167.29 | D38: 161.68 | E38: 120.72 | F38: 151.09999999999999 | G38: =AVERAGE(B38:F38) -> 150.096
A39: 尚品宅配 | B39: 117.13 | C39: 136.31 | D39: 231.27 | E39: 280.95 | F39: 326.22 | G39: =AVERAGE(B39:F39) -> 218.376
A40: 宏发股份 | B40: 238.75 | C40: 118.41 | D40: 103.49 | E40: 85.55 | F40: 160.53 | G40: =AVERAGE(B40:F40) -> 141.346
A41: 好莱客 | B41: 110.46 | C41: 123.53 | D41: 115.91 | E41: 144.69999999999999 | F41: 132.02 | G41: =AVERAGE(B41:F41) -> 125.324