A1: 股票简称 | B1: 加权净资产收益率(%)2019.12.31 | C1: 加权净资产收益率(%)2018.12.31 | D1: 加权净资产收益率(%)2017.12.31 | E1: 加权净资产收益率(%)2016.12.31 | F1: 加权净资产收益率(%)2015.12.31
A2: 安图生物 | B2: 34.81 | C2: 32.200000000000003 | D2: 27.68 | E2: 32.22 | F2: 46.36 | G2: =AVERAGE(B2:F2) -> 34.654
A3: 海天味业 | B3: 33.69 | C3: 32.66 | D3: 31.12 | E3: 32. | F3: 32. | G3: =AVERAGE(B3:F3) -> 32.294
A4: 贵州茅台 | B4: 33.09 | C4: 34.46 | D4: 32.95 | E4: 24.44 | F4: 26.23 | G4: =AVERAGE(B4:F4) -> 30.234
A5: 浙江美大 | B5: 33.05 | C5: 29.28 | D5: 25.73 | E5: 18.5 | F5: 15.32 | G5: =AVERAGE(B5:F5) -> 24.376
A6: 三七互娱 | B6: 32.66 | C6: 16.59 | D6: 28.12 | E6: 26.56 | F6: 17.58 | G6: =AVERAGE(B6:F6) -> 24.302
A7: 亿联网络 | B7: 31.47 | C7: 26.899999999999999 | D7: 26.67 | E7: 71.36 | F7: 74.51 | G7: =AVERAGE(B7:F7) -> 46.182
A8: 健帆生物 | B8: 30.24 | C8: 26.300000000000001 | D8: 22.21 | E8: 24.08 | F8: 39.58 | G8: =AVERAGE(B8:F8) -> 28.482
A9: 通策医疗 | B9: 29.87 | C9: 28.66 | D9: 23.39 | E9: 18.17 | F9: 26.52 | G9: =AVERAGE(B9:F9) -> 25.322
A10: 济川药业 | B10: 28.43 | C10: 34.74 | D10: 31.78 | E10: 29.95 | F10: 28.57 | G10: =AVERAGE(B10:F10) -> 30.694
A11: 吉比特 | B11: 28.14 | C11: 28.05 | D11: 29.58 | E11: 78.900000000000006 | F11: 43.74 | G11: =AVERAGE(B11:F11) -> 41.682
A12: 伟星新材 | B12: 27.05 | C12: 29.45 | D12: 28.19 | E12: 26.15 | F12: 21.46 | G12: =AVERAGE(B12:F12) -> 26.46
A13: 伟明环保 | B13: 26.54 | C13: 28.74 | D13: 24.24 | E13: 18.23 | F13: 21.48 | G13: =AVERAGE(B13:F13) -> 23.846
A14: 伊利股份 | B14: 26.38 | C14: 24.33 | D14: 25.22 | E14: 26.58 | F14: 23.87 | G14: =AVERAGE(B14:F14) -> 25.276
A15: 老板电器 | B15: 25.100000000000001 | C15: 26.399999999999999 | D15: 31.66 | E15: 33.38 | F15: 29.100000000000001 | G15: =AVERAGE(B15:F15) -> 29.128
A16: 浙江鼎力 | B16: 23.96 | C16: 20.05 | D16: 22.14 | E16: 17.48 | F16: 16.78 | G16: =AVERAGE(B16:F16) -> 20.082
A17: 弘亚数控 | B17: 23.83 | C17: 25.42 | D17: 28.67 | E17: 42.52 | F17: 30.03 | G17: =AVERAGE(B17:F17) -> 30.094
A18: 联美控股 | B18: 23.67 | C18: 17.48 | D18: 17.84 | E18: 32.74 | F18: 16.39 | G18: =AVERAGE(B18:F18) -> 21.624
A19: 集友股份 | B19: 23.5 | C19: 20.04 | D19: 21.41 | E19: 29.94 | F19: 29.97 | G19: =AVERAGE(B19:F19) -> 24.972
A20: 金牌厨柜 | B20: 22.92 | C20: 22.65 | D20: 27.78 | E20: 39.53 | F20: 26.33 | G20: =AVERAGE(B20:F20) -> 27.842
A21: 爱尔眼科 | B21: 22.51 | C21: 18.55 | D21: 21.74 | E21: 21.84 | F21: 19.66 | G21: =AVERAGE(B21:F21) -> 20.86
A22: 顾家家居 | B22: 21.98 | C22: 22.96 | D22: 22.26 | E22: 37.25 | F22: 49.88 | G22: =AVERAGE(B22:F22) -> 30.866
A23: 今世缘 | B23: 21.93 | C23: 20.36 | D23: 18.11 | E23: 17.600000000000001 | F23: 18.16 | G23: =AVERAGE(B23:F23) -> 19.232
A24: 欧派家居 | B24: 21.66 | C24: 22.72 | D24: 25.75 | E24: 39.45 | F24: 28.44 | G24: =AVERAGE(B24:F24) -> 27.604
A25: 索菲亚 | B25: 21.34 | C25: 20.64 | D25: 21.98 | E25: 22.55 | F25: 21.85 | G25: =AVERAGE(B25:F25) -> 21.672
A26: 洋河股份 | B26: 21.21 | C26: 25.95 | D26: 24.08 | E26: 24.01 | F26: 25.37 | G26: =AVERAGE(B26:F26) -> 24.124
A27: 桃李面包 | B27: 19.56 | C27: 19.71 | D27: 22.36 | E27: 22.42 | F27: 30.33 | G27: =AVERAGE(B27:F27) -> 22.876
A28: 正海生物 | B28: 19.22 | C28: 17.09 | D28: 16.63 | E28: 22.49 | F28: 33.799999999999997 | G28: =AVERAGE(B28:F28) -> 21.846
A29: 快克股份 | B29: 19. | C29: 19.72 | D29: 19.62 | E29: 37.36 | F29: 33.04 | G29: =AVERAGE(B29:F29) -> 25.748
A30: 荣泰健康 | B30: 18.899999999999999 | C30: 17.600000000000001 | D30: 18.85 | E30: 55.46 | F30: 59.36 | G30: =AVERAGE(B30:F30) -> 34.034
A31: 法拉电子 | B31: 18.23 | C31: 19.48 | D31: 19.56 | E31: 19.51 | F31: 17.87 | G31: =AVERAGE(B31:F31) -> 18.93
A32: 新坐标 | B32: 17.91 | C32: 16.42 | D32: 21.04 | E32: 21.82 | F32: 20.97 | G32: =AVERAGE(B32:F32) -> 19.632
A33: 泛微网络 | B33: 17.39 | C33: 17.42 | D33: 16.44 | E33: 24.86 | F33: 24.64 | G33: =AVERAGE(B33:F33) -> 20.15
A34: 元祖股份 | B34: 17.17 | C34: 19.78 | D34: 18.19 | E34: 26.800000000000001 | F34: 28.48 | G34: =AVERAGE(B34:F34) -> 22.084
A35: 富森美 | B35: 16.92 | C35: 16.76 | D35: 16.25 | E35: 20.42 | F35: 21.800000000000001 | G35: =AVERAGE(B35:F35) -> 18.43
A36: 乐凯新材 | B36: 16.57 | C36: 17.54 | D36: 19.77 | E36: 23.54 | F36: 28.49 | G36: =AVERAGE(B36:F36) -> 21.182
A37: 东港股份 | B37: 16.55 | C37: 16.600000000000001 | D37: 15.95 | E37: 15.11 | F37: 16.19 | G37: =AVERAGE(B37:F37) -> 16.08
A38: 崇达技术 | B38: 16.53 | C38: 20.99 | D38: 20.26 | E38: 27.48 | F38: 32.12 | G38: =AVERAGE(B38:F38) -> 23.476
A39: 尚品宅配 | B39: 16.14 | C39: 17.08 | D39: 18. | E39: 35.200000000000003 | F39: 25.79 | G39: =AVERAGE(B39:F39) -> 22.442
A40: 宏发股份 | B40: 15.21 | C40: 16.82 | D40: 17.91 | E40: 18.13 | F40: 16.64 | G40: =AVERAGE(B40:F40) -> 16.942
A41: 好莱客 | B41: 15.06 | C41: 17.38 | D41: 22.45 | E41: 24.100000000000001 | F41: 20.17 | G41: =AVERAGE(B41:F41) -> 19.832