A1: 股票简称 | B1: 加权净资产收益率(%)2019.12.31 | C1: 加权净资产收益率(%)2018.12.31 | D1: 加权净资产收益率(%)2017.12.31 | E1: 加权净资产收益率(%)2016.12.31 | F1: 加权净资产收益率(%)2015.12.31 | G1: 平均 | H1: 净利润现金含量占比(%)2019.12.31 | I1: 净利润现金含量占比(%)2018.12.31 | J1: 净利润现金含量占比(%)2017.12.31 | K1: 净利润现金含量占比(%)2016.12.31 | L1: 净利润现金含量占比(%)2015.12.31 | M1: 平均 | N1: 销售毛利率(%)2019.12.31 | O1: 销售毛利率(%)2018.12.31 | P1: 销售毛利率(%)2017.12.31 | Q1: 销售毛利率(%)2016.12.31 | R1: 销售毛利率(%)2015.12.31 | S1: 平均
A2: 安图生物 | B2: 34.81 | C2: 32.200000000000003 | D2: 27.68 | E2: 32.22 | F2: 46.36 | G2: =AVERAGE(B2:F2) -> 34.653999999999996 | H2: 108.88 | I2: 116.2 | J2: 107.88 | K2: 118.89 | L2: 111.01 | M2: =AVERAGE(H2:L2) -> 112.572 | N2: 66.57 | O2: 66.38 | P2: 67.49 | Q2: 71.98 | R2: 72.77 | S2: =AVERAGE(N2:R2) -> 69.038
A3: 海天味业 | B3: 33.69 | C3: 32.66 | D3: 31.12 | E3: 32. | F3: 32. | G3: =AVERAGE(B3:F3) -> 32.293999999999997 | H3: 122.69 | I3: 137.38 | J3: 133.68 | K3: 143.29 | L3: 87.46 | M3: =AVERAGE(H3:L3) -> 124.90000000000001 | N3: 67.57 | O3: 67.38 | P3: 68.49 | Q3: 72.98 | R3: 73.77 | S3: =AVERAGE(N3:R3) -> 70.038
A4: 贵州茅台 | B4: 33.09 | C4: 34.46 | D4: 32.95 | E4: 24.44 | F4: 26.23 | G4: =AVERAGE(B4:F4) -> 30.234000000000002 | H4: 109.72 | I4: 117.56 | J4: 81.81 | K4: 224.01 | L4: 112.47 | M4: =AVERAGE(H4:L4) -> 129.114 | N4: 68.57 | O4: 68.38 | P4: 69.49 | Q4: 73.98 | R4: 74.77 | S4: =AVERAGE(N4:R4) -> 71.038
A5: 浙江美大 | B5: 33.05 | C5: 29.28 | D5: 25.73 | E5: 18.5 | F5: 15.32 | G5: =AVERAGE(B5:F5) -> 24.375999999999998 | H5: 118.12 | I5: 117.05 | J5: 147.01 | K5: 131.51 | L5: 99.89 | M5: =AVERAGE(H5:L5) -> 122.71600000000001 | N5: 69.57 | O5: 69.38 | P5: 70.49 | Q5: 74.98 | R5: 75.77 | S5: =AVERAGE(N5:R5) -> 72.038
A6: 健帆生物 | B6: 30.24 | C6: 26.300000000000001 | D6: 22.21 | E6: 24.08 | F6: 39.58 | G6: =AVERAGE(B6:F6) -> 28.481999999999999 | H6: 102.22 | I6: 95.55 | J6: 106.92 | K6: 88.38 | L6: 102.36 | M6: =AVERAGE(H6:L6) -> 99.085999999999999 | N6: 70.57 | O6: 70.38 | P6: 71.49 | Q6: 75.98 | R6: 76.77 | S6: =AVERAGE(N6:R6) -> 73.038
A7: 济川药业 | B7: 28.43 | C7: 34.74 | D7: 31.78 | E7: 29.95 | F7: 28.57 | G7: =AVERAGE(B7:F7) -> 30.693999999999999 | H7: 132.33 | I7: 101.26 | J7: 97.16 | K7: 97.74 | L7: 94.01 | M7: =AVERAGE(H7:L7) -> 104.5 | N7: 71.57 | O7: 71.38 | P7: 72.49 | Q7: 76.98 | R7: 77.77 | S7: =AVERAGE(N7:R7) -> 74.038
A8: 吉比特 | B8: 28.14 | C8: 28.05 | D8: 29.58 | E8: 78.900000000000006 | F8: 43.74 | G8: =AVERAGE(B8:F8) -> 41.682000000000002 | H8: 160.29 | I8: 125.12 | J8: 132.68 | K8: 135.34 | L8: 106.66 | M8: =AVERAGE(H8:L8) -> 132.01799999999997 | N8: 72.57 | O8: 72.38 | P8: 73.49 | Q8: 77.98 | R8: 78.77 | S8: =AVERAGE(N8:R8) -> 75.038
A9: 索菲亚 | B9: 21.34 | C9: 20.64 | D9: 21.98 | E9: 22.55 | F9: 21.85 | G9: =AVERAGE(B9:F9) -> 21.672000000000004 | H9: 120.77 | I9: 114.67 | J9: 137.04 | K9: 179.59999999999999 | L9: 180.76 | M9: =AVERAGE(H9:L9) -> 146.56800000000001 | N9: 75.57 | O9: 75.38 | P9: 76.49 | Q9: 80.98 | R9: 81.77 | S9: =AVERAGE(N9:R9) -> 78.038