A1: 股票简称 | B1: 销售毛利率(%)2019.12.31 | C1: 销售毛利率(%)2018.12.31 | D1: 销售毛利率(%)2017.12.31 | E1: 销售毛利率(%)2016.12.31 | F1: 销售毛利率(%)2015.12.31
A2: 安图生物 | B2: 66.57 | C2: 66.38 | D2: 67.49 | E2: 71.98 | F2: 72.77 | G2: =AVERAGE(B2:F2) -> 69.038
A3: 海天味业 | B3: 67.57 | C3: 67.38 | D3: 68.49 | E3: 72.98 | F3: 73.77 | G3: =AVERAGE(B3:F3) -> 70.038
A4: 贵州茅台 | B4: 68.57 | C4: 68.38 | D4: 69.49 | E4: 73.98 | F4: 74.77 | G4: =AVERAGE(B4:F4) -> 71.038
A5: 浙江美大 | B5: 69.57 | C5: 69.38 | D5: 70.49 | E5: 74.98 | F5: 75.77 | G5: =AVERAGE(B5:F5) -> 72.038
A6: 三七互娱 | B6: 70.57 | C6: 70.38 | D6: 71.49 | E6: 75.98 | F6: 76.77 | G6: =AVERAGE(B6:F6) -> 73.038
A7: 亿联网络 | B7: 71.57 | C7: 71.38 | D7: 72.49 | E7: 76.98 | F7: 77.77 | G7: =AVERAGE(B7:F7) -> 74.038
A8: 健帆生物 | B8: 72.57 | C8: 72.38 | D8: 73.49 | E8: 77.98 | F8: 78.77 | G8: =AVERAGE(B8:F8) -> 75.038
A9: 通策医疗 | B9: 73.57 | C9: 73.38 | D9: 74.49 | E9: 78.98 | F9: 79.77 | G9: =AVERAGE(B9:F9) -> 76.038
A10: 济川药业 | B10: 74.57 | C10: 74.38 | D10: 75.49 | E10: 79.98 | F10: 80.77 | G10: =AVERAGE(B10:F10) -> 77.038
A11: 吉比特 | B11: 75.57 | C11: 75.38 | D11: 76.49 | E11: 80.98 | F11: 81.77 | G11: =AVERAGE(B11:F11) -> 78.038
A12: 伟星新材 | B12: 76.57 | C12: 76.38 | D12: 77.49 | E12: 81.98 | F12: 82.77 | G12: =AVERAGE(B12:F12) -> 79.038
A13: 伟明环保 | B13: 77.57 | C13: 77.38 | D13: 78.49 | E13: 82.98 | F13: 83.77 | G13: =AVERAGE(B13:F13) -> 80.038
A14: 伊利股份 | B14: 78.57 | C14: 78.38 | D14: 79.49 | E14: 83.98 | F14: 84.77 | G14: =AVERAGE(B14:F14) -> 81.038
A15: 老板电器 | B15: 79.57 | C15: 79.38 | D15: 80.49 | E15: 84.98 | F15: 85.77 | G15: =AVERAGE(B15:F15) -> 82.038
A16: 浙江鼎力 | B16: 80.57 | C16: 80.38 | D16: 81.49 | E16: 85.98 | F16: 86.77 | G16: =AVERAGE(B16:F16) -> 83.038
A17: 弘亚数控 | B17: 81.57 | C17: 81.38 | D17: 82.49 | E17: 86.98 | F17: 87.77 | G17: =AVERAGE(B17:F17) -> 84.038
A18: 联美控股 | B18: 82.57 | C18: 82.38 | D18: 83.49 | E18: 87.98 | F18: 88.77 | G18: =AVERAGE(B18:F18) -> 85.038
A19: 集友股份 | B19: 83.57 | C19: 83.38 | D19: 84.49 | E19: 88.98 | F19: 89.77 | G19: =AVERAGE(B19:F19) -> 86.038
A20: 金牌厨柜 | B20: 84.57 | C20: 84.38 | D20: 85.49 | E20: 89.98 | F20: 90.77 | G20: =AVERAGE(B20:F20) -> 87.038
A21: 爱尔眼科 | B21: 85.57 | C21: 85.38 | D21: 86.49 | E21: 90.98 | F21: 91.77 | G21: =AVERAGE(B21:F21) -> 88.038
A22: 顾家家居 | B22: 86.57 | C22: 86.38 | D22: 87.49 | E22: 91.98 | F22: 92.77 | G22: =AVERAGE(B22:F22) -> 89.038
A23: 今世缘 | B23: 87.57 | C23: 87.38 | D23: 88.49 | E23: 92.98 | F23: 93.77 | G23: =AVERAGE(B23:F23) -> 90.038
A24: 欧派家居 | B24: 88.57 | C24: 88.38 | D24: 89.49 | E24: 93.98 | F24: 94.77 | G24: =AVERAGE(B24:F24) -> 91.038
A25: 索菲亚 | B25: 89.57 | C25: 89.38 | D25: 90.49 | E25: 94.98 | F25: 95.77 | G25: =AVERAGE(B25:F25) -> 92.038
A26: 洋河股份 | B26: 90.57 | C26: 90.38 | D26: 91.49 | E26: 95.98 | F26: 96.77 | G26: =AVERAGE(B26:F26) -> 93.038
A27: 桃李面包 | B27: 91.57 | C27: 91.38 | D27: 92.49 | E27: 96.98 | F27: 97.77 | G27: =AVERAGE(B27:F27) -> 94.038
A28: 正海生物 | B28: 92.57 | C28: 92.38 | D28: 93.49 | E28: 97.98 | F28: 98.77 | G28: =AVERAGE(B28:F28) -> 95.038
A29: 快克股份 | B29: 93.57 | C29: 93.38 | D29: 94.49 | E29: 98.98 | F29: 99.77 | G29: =AVERAGE(B29:F29) -> 96.038
A30: 荣泰健康 | B30: 94.57 | C30: 94.38 | D30: 95.49 | E30: 99.98 | F30: 100.77 | G30: =AVERAGE(B30:F30) -> 97.038
A31: 法拉电子 | B31: 95.57 | C31: 95.38 | D31: 96.49 | E31: 100.98 | F31: 101.77 | G31: =AVERAGE(B31:F31) -> 98.038
A32: 新坐标 | B32: 96.57 | C32: 96.38 | D32: 97.49 | E32: 101.98 | F32: 102.77 | G32: =AVERAGE(B32:F32) -> 99.038
A33: 泛微网络 | B33: 97.57 | C33: 97.38 | D33: 98.49 | E33: 102.98 | F33: 103.77 | G33: =AVERAGE(B33:F33) -> 100.038
A34: 元祖股份 | B34: 98.57 | C34: 98.38 | D34: 99.49 | E34: 103.98 | F34: 104.77 | G34: =AVERAGE(B34:F34) -> 101.038
A35: 富森美 | B35: 99.57 | C35: 99.38 | D35: 100.49 | E35: 104.98 | F35: 105.77 | G35: =AVERAGE(B35:F35) -> 102.038
A36: 乐凯新材 | B36: 100.57 | C36: 100.38 | D36: 101.49 | E36: 105.98 | F36: 106.77 | G36: =AVERAGE(B36:F36) -> 103.038
A37: 东港股份 | B37: 101.57 | C37: 101.38 | D37: 102.49 | E37: 106.98 | F37: 107.77 | G37: =AVERAGE(B37:F37) -> 104.038
A38: 崇达技术 | B38: 102.57 | C38: 102.38 | D38: 103.49 | E38: 107.98 | F38: 108.77 | G38: =AVERAGE(B38:F38) -> 105.038
A39: 尚品宅配 | B39: 103.57 | C39: 103.38 | D39: 104.49 | E39: 108.98 | F39: 109.77 | G39: =AVERAGE(B39:F39) -> 106.038
A40: 宏发股份 | B40: 104.57 | C40: 104.38 | D40: 105.49 | E40: 109.98 | F40: 110.77 | G40: =AVERAGE(B40:F40) -> 107.038
A41: 好莱客 | B41: 105.57 | C41: 105.38 | D41: 106.49 | E41: 110.98 | F41: 111.77 | G41: =AVERAGE(B41:F41) -> 108.038